{"allocation_status":"reviewed-one-time-allocation","allocations":[{"assigned_id":"rcid:v1:assertion-derivation:u7:01a08ef7-2c40-7cc2-91f3-3debe5bd8732","canonical_key":"derivation.observation-to-claim-adjudication","entity_class":"assertion-derivation"},{"assigned_id":"rcid:v1:schema-family:u7:01a08ef7-2c40-7aa1-8b61-0d334a5b2451","canonical_key":"schema.observation-to-claim-adjudication","entity_class":"schema-family"}],"published_on":"2026-09-11","schema_version":"adjudication-allocation.v1"}
